Text,Openness,Conscientiousness,Extraversion,Agreeableness,Neuroticism,cleaned_text,tokens
Current status: I’m not really a control freak. But... can I show you the right way to do that? 👨‍🏫🔮,0.045454545454545414,1.0,0.31746031746031744,0.0,0.8227848101265822,current status im really control freak show right way,"['current', 'status', 'really', 'control', 'freak', 'show', 'right', 'way']"
"Life truth: When your mum is mad at your dad, don’t let her brush your hair. 👧‍🦱🌬️",0.6818181818181817,0.5106382978723405,0.31746031746031744,0.6046511627906977,0.7594936708860758,life truth mum mad dad dont let brush hair,"['life', 'truth', 'mum', 'mad', 'dad', 'let', 'brush', 'hair']"
"Self-improvement plan: I’m on a seafood diet. I see food, and I eat it. 🐠🍕",0.8409090909090908,0.06382978723404256,0.9999999999999999,0.7906976744186047,0.2784810126582278,selfimprovement plan im seafood diet see food eat,"['plan', 'seafood', 'diet', 'see', 'food', 'eat']"
Relationship philosophy: Marry someone who has a different favorite cereal than you so they won’t eat all of yours. 🥛💑,0.8863636363636365,0.5744680851063829,0.31746031746031744,0.9534883720930232,0.2784810126582278,relationship philosophy marry someone different favorite cereal wont eat,"['relationship', 'philosophy', 'marry', 'someone', 'different', 'favorite', 'cereal', 'eat']"
Just binge-watched the entire series overnight. Who needs sleep anyway? #teamnosleep 🌙📺,0.7272727272727273,0.23404255319148937,0.7936507936507936,0.37209302325581395,0.6455696202531644,bingewatched entire series overnight needs sleep anyway teamnosleep,"['entire', 'series', 'overnight', 'need', 'sleep', 'anyway', 'teamnosleep']"
"Is it just me, or does choosing a filter take longer than writing a midterm essay? 🤳💭",0.6590909090909092,0.4893617021276596,0.7619047619047619,0.5813953488372093,0.5189873417721518,choosing filter take longer writing midterm essay,"['choosing', 'filter', 'take', 'longer', 'writing', 'midterm', 'essay']"
"Deleted social media for a day. It was tough, but I think I reached enlightenment. ✨🧘‍♀️",0.8636363636363635,0.36170212765957444,0.5555555555555556,0.6511627906976744,0.4430379746835442,deleted social media day tough think reached enlightenment,"['deleted', 'social', 'medium', 'day', 'tough', 'think', 'reached', 'enlightenment']"
Remember the time when 'brb' meant 'be right back' and not 'I'm ignoring you forever'? 💔🕰️,0.5681818181818181,0.5319148936170214,0.8253968253968254,0.4418604651162791,0.620253164556962,remember time brb meant right back im ignoring forever,"['remember', 'time', 'meant', 'right', 'back', 'ignoring', 'forever']"
"Can't decide if I need a hug, 6 cups of coffee, or 6 months of vacation. 🤗☕✈️",0.5909090909090908,0.2765957446808511,0.7936507936507936,0.5581395348837209,0.721518987341772,cant decide need hug 6 cups coffee 6 months vacation,"['ca', 'decide', 'need', 'hug', 'cup', 'coffee', 'month', 'vacation']"
"Why do job applications require 5 years of experience for an entry-level position? I'm 20, not a time traveler. 🕰️🤷‍♂️",0.6818181818181817,0.5957446808510638,0.746031746031746,0.41860465116279066,0.5569620253164556,job applications require 5 years experience entrylevel position im 20 time traveler,"['job', 'application', 'require', 'year', 'experience', 'position', 'time', 'traveler']"
I swear my room has two states: 'Neat for Instagram' and 'Looks like a tornado hit'. There's no in-between. 🌪️📸,0.6136363636363635,0.29787234042553196,0.7777777777777777,0.5116279069767442,0.49367088607594933,swear room two states neat instagram looks like tornado hit theres inbetween,"['swear', 'room', 'two', 'state', 'instagram', 'like', 'tornado', 'hit']"
"My grocery shopping is 10% food and 90% snacks. Balance is key, right? 🍩🥦",0.5454545454545454,0.2553191489361702,0.8571428571428572,0.7209302325581395,0.4683544303797468,grocery shopping 10 food 90 snacks balance key right,"['grocery', 'shopping', 'food', 'snack', 'balance', 'key', 'right']"
Ordered a pizza and ate it all. Fitness goals: being able to eat more pizza. 🍕💪,0.49999999999999994,0.3404255319148936,0.8095238095238094,0.627906976744186,0.4430379746835442,ordered pizza ate fitness goals able eat pizza,"['ordered', 'pizza', 'ate', 'fitness', 'goal', 'able', 'eat', 'pizza']"
Is adulthood just clicking 'Forgot Password' over and over until you die? 💻🔒,0.6590909090909092,0.4042553191489362,0.7301587301587301,0.4651162790697675,0.5822784810126581,adulthood clicking forgot password die,"['adulthood', 'clicking', 'password', 'die']"
"Studying online sounded cool until I realized it's just me, alone with my snacks and distractions. 📚🍪",0.6363636363636362,0.36170212765957444,0.6190476190476191,0.5348837209302325,0.6455696202531644,studying online sounded cool realized alone snacks distractions,"['studying', 'online', 'sounded', 'cool', 'realized', 'alone', 'snack', 'distraction']"
Why is 'adulting' not a subject in school? I need a refund on my education. 🏫💸,0.7727272727272727,0.5106382978723405,0.8412698412698412,0.34883720930232565,0.5443037974683543,adulting subject school need refund education,"['subject', 'school', 'need', 'refund', 'education']"
"I speak fluent sarcasm, meme, and song lyrics. Multilingual, right? 🙃🎵",0.8409090909090908,0.31914893617021284,0.8888888888888887,0.6511627906976744,0.5063291139240506,speak fluent sarcasm meme song lyrics multilingual right,"['speak', 'fluent', 'sarcasm', 'meme', 'song', 'lyric', 'multilingual', 'right']"
Every group project has that one person who's basically a ghost. Spoiler: It's me. 👻📚,0.4545454545454544,0.21276595744680848,0.5238095238095237,0.39534883720930236,0.5949367088607593,every group project one person whos basically ghost spoiler,"['every', 'group', 'project', 'one', 'person', 'basically', 'ghost', 'spoiler']"
Life hack: you can't fail if you don't try. Right? 😅🚫,0.5909090909090908,0.17021276595744683,0.6666666666666666,0.4418604651162791,0.6835443037974682,life hack cant fail dont try right,"['life', 'hack', 'ca', 'fail', 'try', 'right']"
Who knew being in your 20s is just texting friends 'We should hang out soon' over and over until one of you dies? 📱⚰️,0.6136363636363635,0.44680851063829785,0.7142857142857143,0.4883720930232559,0.620253164556962,knew 20s texting friends hang soon one dies,"['knew', 'texting', 'friend', 'hang', 'soon', 'one', 'dy']"
Obsessed with canceling plans that I never wanted to be a part of. Ultimate bliss. 😌🚫,0.5227272727272727,0.3404255319148936,0.4603174603174603,0.37209302325581395,0.5569620253164556,obsessed canceling plans never wanted part ultimate bliss,"['obsessed', 'canceling', 'plan', 'never', 'wanted', 'part', 'ultimate', 'bliss']"
"Is my life a joke to you? Wait, don't answer that. 😔🎭",0.5454545454545454,0.29787234042553196,0.7619047619047619,0.32558139534883723,0.7468354430379747,life joke wait dont answer,"['life', 'joke', 'wait', 'answer']"
"I have 3 moods: Skip every song on my playlist, let the music play without interruption, and play the same song on repeat. 🎶🔄",0.7272727272727273,0.4255319148936171,0.7777777777777777,0.6046511627906977,0.5316455696202531,3 moods skip every song playlist let music play without interruption play song repeat,"['mood', 'skip', 'every', 'song', 'playlist', 'let', 'music', 'play', 'without', 'interruption', 'play', 'song', 'repeat']"
"Permanent mood: 'Sorry, I'm late... I didn't want to come.' 🕰️🚶‍♀️",0.5681818181818181,0.19148936170212771,0.6507936507936507,0.2790697674418605,0.5822784810126581,permanent mood sorry im late didnt want come,"['permanent', 'mood', 'late', 'want', 'come']"
"Just learned how to cook ramen 5 different ways, so I'm basically a chef now. #MasterChef 🍜",0.6590909090909092,0.4893617021276596,0.8095238095238094,0.627906976744186,0.4683544303797468,learned cook ramen 5 different ways im basically chef masterchef,"['learned', 'cook', 'ramen', 'different', 'way', 'basically', 'chef', 'masterchef']"
"I have 99 problems, and my phone battery is all of them. 🔋😩",0.49999999999999994,0.44680851063829785,0.8412698412698412,0.5116279069767442,0.6582278481012658,99 problems phone battery,"['problem', 'phone', 'battery']"
Skincare routine: 10 steps. Preparing for my future: still figuring out step 1. 🤷‍♀️💆‍♀️,0.6363636363636362,0.3404255319148936,0.7936507936507936,0.4651162790697675,0.6329113924050631,skincare routine 10 steps preparing future still figuring step 1,"['skincare', 'routine', 'step', 'preparing', 'future', 'still', 'figuring', 'step']"
Can we have a moment of silence for all the outfits I bought for 2020 and never wore? 👗👔,0.7727272727272727,0.46808510638297873,0.7777777777777777,0.41860465116279066,0.5949367088607593,moment silence outfits bought 2020 never wore,"['moment', 'silence', 'outfit', 'bought', 'never', 'wore']"
My diet is a mysterious cycle of superfoods and junk food. No in-between. 🥑🍕,0.6136363636363635,0.31914893617021284,0.8253968253968254,0.5813953488372093,0.5189873417721518,diet mysterious cycle superfoods junk food inbetween,"['diet', 'mysterious', 'cycle', 'superfoods', 'junk', 'food']"
"Life update: Googled 'how to win an argument with your cat'... so, yeah. 🐱🗣️",0.8863636363636365,0.3829787234042553,0.7619047619047619,0.6976744186046512,0.49367088607594933,life update googled win argument cat yeah,"['life', 'update', 'googled', 'win', 'argument', 'cat', 'yeah']"
I've reached the 'adding things I've already done to my to-do list just to cross them off' level of productivity. ✅😂,0.5909090909090908,0.7446808510638299,0.7301587301587301,0.5348837209302325,0.5063291139240506,ive reached adding things ive already done todo list cross level productivity,"['reached', 'thing', 'already', 'done', 'list', 'cross', 'level', 'productivity']"
Starting a petition to count 'staying in bed all day' as a personality trait. Who's in? 🛌✨,0.5454545454545454,0.23404255319148937,0.6349206349206349,0.6744186046511628,0.6835443037974682,starting petition count staying bed day personality trait whos,"['starting', 'petition', 'count', 'bed', 'day', 'personality', 'trait']"
Today's mood: 'I did not wake up to be mediocre.' Also me: *watches 6 hours of Netflix* 📺🛋️,0.7272727272727273,0.2765957446808511,0.746031746031746,0.39534883720930236,0.5822784810126581,todays mood wake mediocre also watches 6 hours netflix,"['today', 'mood', 'wake', 'mediocre', 'also', 'watch', 'hour', 'netflix']"
Sending 'OK' with the period is the text version of a slap. Change my mind. 😤✋,0.5227272727272727,0.5531914893617021,0.8095238095238094,0.3023255813953488,0.6582278481012658,sending ok period text version slap change mind,"['sending', 'period', 'text', 'version', 'slap', 'change', 'mind']"
That mini heart attack when you can't feel these in your pocket: 💳🔑📱,0.47727272727272724,0.6382978723404256,0.7142857142857143,0.4883720930232559,0.721518987341772,mini heart attack cant feel pocket,"['mini', 'heart', 'attack', 'ca', 'feel', 'pocket']"
I think 'selective listener' is a nicer way to put 'I ignore most of what you say.' 🙉🤷‍♀️,0.49999999999999994,0.4255319148936171,0.7777777777777777,0.2558139534883721,0.5696202531645569,think selective listener nicer way put ignore say,"['think', 'listener', 'nicer', 'way', 'put', 'ignore', 'say']"
Throwback to when I was 12 and thought turning 18 meant I would have my life together. 😅🎂,0.6818181818181817,0.36170212765957444,0.7619047619047619,0.5116279069767442,0.6455696202531644,throwback 12 thought turning 18 meant would life together,"['throwback', 'thought', 'turning', 'meant', 'would', 'life', 'together']"
"I either respond to texts in 0.2 seconds, or I forget for 8 days. There's no in-between. 📱⏳",0.5681818181818181,0.2553191489361702,0.7936507936507936,0.41860465116279066,0.620253164556962,either respond texts 02 seconds forget 8 days theres inbetween,"['either', 'respond', 'text', 'second', 'forget', 'day']"
"If procrastination is an art, I belong in the Louvre. 🎨⏰",0.75,0.19148936170212771,0.6984126984126984,0.6046511627906977,0.5189873417721518,procrastination art belong louvre,"['procrastination', 'art', 'belong', 'louvre']"
Can we skip to the part of my life where I travel the world? ✈️🌍,0.9545454545454546,0.3404255319148936,0.8730158730158729,0.6511627906976744,0.48101265822784806,skip part life travel world,"['skip', 'part', 'life', 'travel', 'world']"
Is it really a Sunday if you're not questioning all your life choices? 🤔🛌,0.6136363636363635,0.4042553191489362,0.6507936507936507,0.4418604651162791,0.6708860759493669,really sunday youre questioning life choices,"['really', 'sunday', 'questioning', 'life', 'choice']"
Trying to explain your favorite show to someone who's never watched it is a special kind of torture. 📺😤,0.6590909090909092,0.4893617021276596,0.8412698412698412,0.39534883720930236,0.5569620253164556,trying explain favorite show someone whos never watched special kind torture,"['trying', 'explain', 'favorite', 'show', 'someone', 'never', 'watched', 'special', 'kind', 'torture']"
Does anyone else have a shopping cart filled with online orders you're too broke to buy? 🛒💸,0.6818181818181817,0.29787234042553196,0.7777777777777777,0.5348837209302325,0.620253164556962,anyone else shopping cart filled online orders youre broke buy,"['anyone', 'else', 'shopping', 'cart', 'filled', 'online', 'order', 'broke', 'buy']"
90% of my life is spent worrying about the 10% of things I can't control. 🤦‍♂️💭,0.49999999999999994,0.44680851063829785,0.6666666666666666,0.37209302325581395,0.7341772151898733,90 life spent worrying 10 things cant control,"['life', 'spent', 'worrying', 'thing', 'ca', 'control']"
Am I the only one who plans my outfits around the level of effort I feel like putting into my day? 👚👖,0.7727272727272727,0.3404255319148936,0.8095238095238094,0.5581395348837209,0.5316455696202531,one plans outfits around level effort feel like putting day,"['one', 'plan', 'outfit', 'around', 'level', 'effort', 'feel', 'like', 'putting', 'day']"
"Just once, I want someone to look at me the way I look at the 'Skip Intro' button. 😍📺",0.6136363636363635,0.4255319148936171,0.8253968253968254,0.5116279069767442,0.5063291139240506,want someone look way look skip intro button,"['want', 'someone', 'look', 'way', 'look', 'intro', 'button']"
"My 'Seen' at 2:00 AM might mean I'm a night owl, or maybe I just dropped my phone on my face again. 🌙📱",0.5681818181818181,0.2553191489361702,0.746031746031746,0.5813953488372093,0.5822784810126581,seen 200 might mean im night owl maybe dropped phone face,"['might', 'mean', 'night', 'owl', 'maybe', 'dropped', 'phone', 'face']"
Being an adult is just whispering 'What the...?' to yourself all day because you don't know what's happening. 🤷‍♂️🌪️,0.5227272727272727,0.31914893617021284,0.7777777777777777,0.39534883720930236,0.6962025316455696,adult whispering day dont know whats happening,"['adult', 'whispering', 'day', 'know', 'happening']"
Is it bad that my dog's Instagram is doing better than my own? 🐶📸,0.7045454545454546,0.46808510638297873,0.7936507936507936,0.6511627906976744,0.4683544303797468,bad dogs instagram better,"['bad', 'dog', 'instagram', 'better']"
Life hack: Can't be late if you don't show up. 😏⏰,0.4545454545454544,0.21276595744680848,0.7142857142857143,0.32558139534883723,0.5443037974683543,life hack cant late dont show,"['life', 'hack', 'ca', 'late', 'show']"
"Remember when you felt 'too young' to do things, and now you're 'too old'? When was the perfect age window, like, a week? 🤔🔙",0.6590909090909092,0.4893617021276596,0.7619047619047619,0.4883720930232559,0.6582278481012658,remember felt young things youre old perfect age window like week,"['remember', 'felt', 'young', 'thing', 'old', 'perfect', 'age', 'window', 'like', 'week']"
Every machine is a smoke machine if you operate it wrong enough! 😅🔥,0.8409090909090908,0.29787234042553196,0.8412698412698412,0.627906976744186,0.5189873417721518,every machine smoke machine operate wrong enough,"['every', 'machine', 'smoke', 'machine', 'operate', 'wrong', 'enough']"
Does 'perpetually craving tacos' count as a mood? 🌮❤️,0.6363636363636362,0.4042553191489362,0.8571428571428572,0.6744186046511628,0.49367088607594933,perpetually craving tacos count mood,"['craving', 'taco', 'count', 'mood']"
"'Eat healthier,' they said. 'It'll be easy,' they said. Meanwhile, I'm emotionally attached to fries. 🍟😭",0.5454545454545454,0.2765957446808511,0.8095238095238094,0.34883720930232565,0.6329113924050631,eat healthier said itll easy said meanwhile im emotionally attached fries,"['healthier', 'said', 'easy', 'said', 'meanwhile', 'emotionally', 'attached', 'fry']"
"The floor is lava!... is a fun game and all, but have you ever tried 'The floor is my clothes'? 🔥👚",0.5909090909090908,0.14893617021276595,0.7301587301587301,0.5348837209302325,0.5949367088607593,floor lava fun game ever tried floor clothes,"['floor', 'lava', 'fun', 'game', 'ever', 'tried', 'floor', 'clothes']"
"Plot twist: I don't need a knight in shining armor, I need WiFi that doesn't lag. 🏰📶",0.7272727272727273,0.44680851063829785,0.7777777777777777,0.4651162790697675,0.48101265822784806,plot twist dont need knight shining armor need wifi doesnt lag,"['plot', 'twist', 'need', 'knight', 'shining', 'armor', 'need', 'wifi', 'lag']"
"If I got a dollar for every time my grandparents asked me to fix their computer, I could retire. 💻💵",0.47727272727272724,0.5319148936170214,0.746031746031746,0.7209302325581395,0.5189873417721518,got dollar every time grandparents asked fix computer could retire,"['got', 'dollar', 'every', 'time', 'grandparent', 'asked', 'fix', 'computer', 'could', 'retire']"
Why study for exams when you can stress-eat and spiral into existential dread? 📚🍔,0.6136363636363635,0.23404255319148937,0.6825396825396824,0.37209302325581395,0.7468354430379747,study exams stresseat spiral existential dread,"['study', 'exam', 'spiral', 'existential', 'dread']"
Is 'exhausted pigeon' an accurate way to describe my aesthetic? 🐦😴,0.5227272727272727,0.3404255319148936,0.6349206349206349,0.6511627906976744,0.6835443037974682,exhausted pigeon accurate way describe aesthetic,"['pigeon', 'accurate', 'way', 'describe', 'aesthetic']"
"My life's an open book, but it's mostly just emails from brands I bought from once in 2015. 📖📧",0.6818181818181817,0.4255319148936171,0.7142857142857143,0.4883720930232559,0.5696202531645569,lifes open book mostly emails brands bought 2015,"['life', 'open', 'book', 'mostly', 'email', 'brand', 'bought']"
"Too poor to go out, too anxious to invite people over. It's a party in my comfort zone! 🎉🚪",0.5454545454545454,0.46808510638297873,0.603174603174603,0.34883720930232565,0.7088607594936709,poor go anxious invite people party comfort zone,"['poor', 'go', 'anxious', 'invite', 'people', 'party', 'comfort', 'zone']"
"I live by the motto 'Treat yourself.' Except, it's every day and causing problems. 😅💳",0.6363636363636362,0.19148936170212771,0.8253968253968254,0.5581395348837209,0.5316455696202531,live motto treat except every day causing problems,"['live', 'motto', 'except', 'every', 'day', 'causing', 'problem']"
"Big plans this weekend. By 'big plans,' I mean choosing a new series to binge-watch. Suggestions? 🤔🎬",0.75,0.36170212765957444,0.7619047619047619,0.6046511627906977,0.49367088607594933,big plans weekend big plans mean choosing new series bingewatch suggestions,"['big', 'plan', 'weekend', 'plan', 'mean', 'choosing', 'new', 'series', 'suggestion']"
"If you're not supposed to eat at night, why is there a light in the fridge? 🤷‍♂️🌜",0.6136363636363635,0.2765957446808511,0.7777777777777777,0.5348837209302325,0.5949367088607593,youre supposed eat night light fridge,"['supposed', 'eat', 'night', 'light', 'fridge']"
"Got my 8 hours of anxiety last night, how about you? 😴💤",0.4545454545454544,0.3829787234042553,0.6507936507936507,0.41860465116279066,0.7721518987341771,got 8 hours anxiety last night,"['got', 'hour', 'anxiety', 'last', 'night']"
"If I could get paid to make random Spotify playlists, I'd be a billionaire. 🎧💰",0.8409090909090908,0.3404255319148936,0.7936507936507936,0.627906976744186,0.4556962025316455,could get paid make random spotify playlists id billionaire,"['could', 'get', 'paid', 'make', 'random', 'spotify', 'playlist', 'billionaire']"
I'm at that 'read everything but understand nothing' stage of studying. Send help. 📚🆘,0.5681818181818181,0.5106382978723405,0.6984126984126984,0.4418604651162791,0.6962025316455696,im read everything understand nothing stage studying send help,"['everything', 'understand', 'nothing', 'stage', 'studying', 'send', 'help']"
"Asked my mom why she never told me life was this hard. She said she did, I just wasn't listening. Classic. 🤷‍♀️👵",0.49999999999999994,0.4255319148936171,0.7301587301587301,0.5116279069767442,0.6582278481012658,asked mom never told life hard said wasnt listening classic,"['asked', 'mom', 'never', 'told', 'life', 'hard', 'said', 'listening', 'classic']"
"Is it a date, or are we just 'hanging out'? The anxiety of modern romance. 💑🤔",0.6590909090909092,0.44680851063829785,0.6825396825396824,0.37209302325581395,0.7341772151898733,date hanging anxiety modern romance,"['date', 'anxiety', 'modern', 'romance']"
Lost my phone and found it in the fridge. It's been a long day. 📱❄️,0.5454545454545454,0.31914893617021284,0.8095238095238094,0.5813953488372093,0.6455696202531644,lost phone found fridge long day,"['lost', 'phone', 'found', 'fridge', 'long', 'day']"
Who else has a 'For Later' reading list that's longer than their 'Read' list? 📚⏳,0.8181818181818183,0.4893617021276596,0.746031746031746,0.6511627906976744,0.4683544303797468,else later reading list thats longer read list,"['else', 'later', 'reading', 'list', 'longer', 'list']"
"I'm not saying I hate mornings, but I'd definitely hit snooze on the sun if I could. ☀️😴",0.47727272727272724,0.2553191489361702,0.7142857142857143,0.4651162790697675,0.6835443037974682,im saying hate mornings id definitely hit snooze sun could,"['saying', 'hate', 'morning', 'definitely', 'hit', 'snooze', 'sun', 'could']"
"Adulthood is just saying 'But after this week, things will slow down a bit' to yourself until you die. 🏃‍♂️💨",0.6136363636363635,0.3404255319148936,0.7619047619047619,0.39534883720930236,0.6582278481012658,adulthood saying week things slow bit die,"['adulthood', 'saying', 'week', 'thing', 'slow', 'bit', 'die']"
"I'm not addicted to my phone, we're just in a very committed relationship. 📱❤️",0.49999999999999994,0.4042553191489362,0.8412698412698412,0.5348837209302325,0.5569620253164556,im addicted phone committed relationship,"['addicted', 'phone', 'committed', 'relationship']"
I aspire to reach the level of calm of people who use 'Regards' as their email sign-off. 📧🧘‍♀️,0.6818181818181817,0.6382978723404256,0.6349206349206349,0.6744186046511628,0.5063291139240506,aspire reach level calm people use regards email signoff,"['aspire', 'reach', 'level', 'calm', 'people', 'use', 'email']"
Being asked 'Where do you see yourself in 5 years?' is my favorite joke now. 😂🔮,0.5909090909090908,0.29787234042553196,0.8253968253968254,0.34883720930232565,0.620253164556962,asked see 5 years favorite joke,"['asked', 'see', 'year', 'favorite', 'joke']"
I'm not great at the advice. Can I interest you in a sarcastic comment? 🤷‍♂️💬,0.5227272727272727,0.46808510638297873,0.7777777777777777,0.186046511627907,0.5822784810126581,im great advice interest sarcastic comment,"['great', 'advice', 'interest', 'sarcastic', 'comment']"
"I'm an adult, but more like an adult cat. Someone should probably take care of me, but I can also sort of make it on my own. 🐱👱",0.7045454545454546,0.36170212765957444,0.7142857142857143,0.5116279069767442,0.6455696202531644,im adult like adult cat someone probably take care also sort make,"['adult', 'like', 'adult', 'cat', 'someone', 'probably', 'take', 'care', 'also', 'sort', 'make']"
"If my life was a movie, it'd be rated 'What the heck is even happening/10' 🎬🤔",0.6363636363636362,0.23404255319148937,0.746031746031746,0.4418604651162791,0.6835443037974682,life movie itd rated heck even happening10,"['life', 'movie', 'rated', 'heck', 'even']"
"Pro tip: Keep a diary, so when you're famous, you can publish and make bank. 📖💰",0.7727272727272727,0.4042553191489362,0.8571428571428572,0.4883720930232559,0.49367088607594933,pro tip keep diary youre famous publish make bank,"['pro', 'tip', 'keep', 'diary', 'famous', 'publish', 'make', 'bank']"
You know you're growing up when you start rooting for the parents in Disney movies. 🎥👪,0.47727272727272724,0.5319148936170214,0.6825396825396824,0.6976744186046512,0.5316455696202531,know youre growing start rooting parents disney movies,"['know', 'growing', 'start', 'rooting', 'parent', 'disney', 'movie']"
'Let's hang out soon!' - Translation: See you in 5 to 7 business years. 🗓️✋,0.49999999999999994,0.3404255319148936,0.7777777777777777,0.37209302325581395,0.6329113924050631,lets hang soon translation see 5 7 business years,"['hang', 'soon', 'translation', 'see', 'business', 'year']"
Can I put 'hasn't lost AirPods yet' on my resume? Skills: Responsible. 🎧📄,0.5909090909090908,0.7234042553191489,0.7301587301587301,0.5581395348837209,0.4683544303797468,put hasnt lost airpods yet resume skills responsible,"['put', 'lost', 'airpods', 'yet', 'resume', 'skill', 'responsible']"
