Text,Openness,Conscientiousness,Extraversion,Agreeableness,Neuroticism,cleaned_text,tokens
Coffee is a hug in a mug. ☕🤗,0.5909090909090908,0.4042553191489362,0.6825396825396824,0.7906976744186047,0.5063291139240506,coffee hug mug,"['coffee', 'hug', 'mug']"
Deciding I'll just do it tomorrow has been the backbone of my productivity for years. 📅🙌,0.6136363636363635,0.44680851063829785,0.7777777777777777,0.6046511627906977,0.5822784810126581,deciding ill tomorrow backbone productivity years,"['deciding', 'tomorrow', 'backbone', 'productivity', 'year']"
I consider 'on time' to be when I get there. 🕒🏃‍♀️,0.7272727272727273,0.29787234042553196,0.746031746031746,0.5116279069767442,0.6708860759493669,consider time get,"['consider', 'time', 'get']"
"If I quit now, they'll never make a movie about me. Unless it's a cautionary tale. 🎬😬",0.5227272727272727,0.4893617021276596,0.6984126984126984,0.7674418604651163,0.5189873417721518,quit theyll never make movie unless cautionary tale,"['quit', 'never', 'make', 'movie', 'unless', 'cautionary', 'tale']"
"I want to be like a caterpillar. Eat a lot, sleep for a while, and then wake up beautiful. 🐛🦋",0.6363636363636362,0.23404255319148937,0.7619047619047619,0.6744186046511628,0.6075949367088607,want like caterpillar eat lot sleep wake beautiful,"['want', 'like', 'caterpillar', 'eat', 'lot', 'sleep', 'wake', 'beautiful']"
Please don't interrupt me while I'm ignoring you. 🙉🚫,0.75,0.3404255319148936,0.8253968253968254,0.37209302325581395,0.620253164556962,please dont interrupt im ignoring,"['please', 'interrupt', 'ignoring']"
My alone time is sometimes for your safety. 🤫🔒,0.6136363636363635,0.5744680851063829,0.7301587301587301,0.34883720930232565,0.7088607594936709,alone time sometimes safety,"['alone', 'time', 'sometimes', 'safety']"
Welcome to adulthood. You have a favorite spatula now. 🥄🎉,0.5681818181818181,0.4255319148936171,0.7142857142857143,0.6511627906976744,0.6455696202531644,welcome adulthood favorite spatula,"['welcome', 'adulthood', 'favorite', 'spatula']"
I'm not saying your perfume is too strong. I'm just saying the canary was alive before you got here. 🐦😵,0.6818181818181817,0.2553191489361702,0.7936507936507936,0.4883720930232559,0.6835443037974682,im saying perfume strong im saying canary alive got,"['saying', 'perfume', 'strong', 'saying', 'canary', 'alive', 'got']"
"Today's mood is brought to you by the letters W, T, and F. 🤷‍♀️🔠",0.6363636363636362,0.3829787234042553,0.8412698412698412,0.41860465116279066,0.5822784810126581,todays mood brought letters w f,"['today', 'mood', 'brought', 'letter', 'w']"
I'm not a hot mess. I'm a spicy disaster. 🌶️💥,0.5454545454545454,0.5106382978723405,0.7777777777777777,0.5348837209302325,0.721518987341772,im hot mess im spicy disaster,"['hot', 'mess', 'spicy', 'disaster']"
"Maybe if we tell people the brain is an app, they'll start using it. 🧠📲",0.6590909090909092,0.2765957446808511,0.8571428571428572,0.4418604651162791,0.620253164556962,maybe tell people brain app theyll start using,"['maybe', 'tell', 'people', 'brain', 'app', 'start', 'using']"
"When I said I wanted to be a somebody, I probably should have been more specific. 🌟😅",0.5909090909090908,0.44680851063829785,0.6666666666666666,0.7209302325581395,0.5316455696202531,said wanted somebody probably specific,"['said', 'wanted', 'somebody', 'probably', 'specific']"
"Life isn't perfect, but your outfit can be. 👗✨",0.6136363636363635,0.21276595744680848,0.746031746031746,0.7674418604651163,0.48101265822784806,life isnt perfect outfit,"['life', 'perfect', 'outfit']"
I'm not good at the advice. Can I interest you in a sarcastic comment? 🤨💬,0.7272727272727273,0.4893617021276596,0.7301587301587301,0.5116279069767442,0.6962025316455696,im good advice interest sarcastic comment,"['good', 'advice', 'interest', 'sarcastic', 'comment']"
"Some days, you're the pigeon. Some days, you're the statue. 🐦🗽",0.5681818181818181,0.36170212765957444,0.7777777777777777,0.39534883720930236,0.7088607594936709,days youre pigeon days youre statue,"['day', 'pigeon', 'day', 'statue']"
Work tip: Stand up. Stretch. Take a walk. Go to the airport. Get on a plane. Never return. ✈️👋,0.75,0.19148936170212771,0.8095238095238094,0.5813953488372093,0.5949367088607593,work tip stand stretch take walk go airport get plane never return,"['work', 'tip', 'stand', 'stretch', 'take', 'walk', 'go', 'airport', 'get', 'plane', 'never', 'return']"
Why do they call it beauty sleep when you wake up looking like a troll? 💤👹,0.6363636363636362,0.46808510638297873,0.6984126984126984,0.6976744186046512,0.5063291139240506,call beauty sleep wake looking like troll,"['call', 'beauty', 'sleep', 'wake', 'looking', 'like', 'troll']"
"I'm not a control freak, but can I show you the right way to do that? 😇👌",0.5454545454545454,0.5531914893617021,0.7142857142857143,0.6744186046511628,0.5569620253164556,im control freak show right way,"['control', 'freak', 'show', 'right', 'way']"
"If Cinderella's shoe fit perfectly, then why did it fall off? 🤔👠",0.6818181818181817,0.29787234042553196,0.8412698412698412,0.37209302325581395,0.6708860759493669,cinderellas shoe fit perfectly fall,"['cinderella', 'shoe', 'fit', 'perfectly', 'fall']"
"Trust is like a mirror, you can fix it if it's broken, but you can still see the crack in that mother's reflection. 🪞💔",0.6136363636363635,0.5957446808510638,0.7619047619047619,0.186046511627907,0.7468354430379747,trust like mirror fix broken still see crack mothers reflection,"['trust', 'like', 'mirror', 'fix', 'broken', 'still', 'see', 'crack', 'mother', 'reflection']"
Is 'UGH' an emotion? Because I feel it all the time. 😑💭,0.5909090909090908,0.4255319148936171,0.6825396825396824,0.744186046511628,0.5316455696202531,ugh emotion feel time,"['emotion', 'feel', 'time']"
"I never make the same mistake twice. I make it like five or six times, you know, just to be sure. 💁‍♀️🔁",0.7272727272727273,0.2553191489361702,0.8253968253968254,0.5581395348837209,0.5822784810126581,never make mistake twice make like five six times know sure,"['never', 'make', 'mistake', 'twice', 'make', 'like', 'five', 'six', 'time', 'know', 'sure']"
Raising kids is a walk in the park. Jurassic Park. 🚶‍♂️🦖,0.6363636363636362,0.3829787234042553,0.7777777777777777,0.6046511627906977,0.6455696202531644,raising kids walk park jurassic park,"['raising', 'kid', 'walk', 'park', 'jurassic', 'park']"
"I'm not arguing, I'm just telling you why I'm right. 🗣️👍",0.5454545454545454,0.5319148936170214,0.7301587301587301,0.34883720930232565,0.721518987341772,im arguing im telling im right,"['arguing', 'telling', 'right']"
"Why do we never have time to do it right, but always have time to do it over? 🏃‍♀️🔄",0.6590909090909092,0.44680851063829785,0.746031746031746,0.5348837209302325,0.6582278481012658,never time right always time,"['never', 'time', 'right', 'always', 'time']"
"I'm at that awkward stage where half my friends are getting married and having kids, and the other half are too drunk to remember their own names. 🍾👶",0.6136363636363635,0.4893617021276596,0.8412698412698412,0.4418604651162791,0.620253164556962,im awkward stage half friends getting married kids half drunk remember names,"['awkward', 'stage', 'half', 'friend', 'getting', 'married', 'kid', 'half', 'drunk', 'remember', 'name']"
"Is it just me, or are 80% of the people in your 'People You May Know' section on Facebook people that you do know, but purposely avoid? 🤷‍♂️💻",0.5909090909090908,0.3404255319148936,0.7619047619047619,0.7906976744186047,0.48101265822784806,80 people people may know section facebook people know purposely avoid,"['people', 'may', 'know', 'section', 'facebook', 'people', 'know', 'purposely', 'avoid']"
I love sleeping because it's like being dead without the commitment. 😴💀,0.75,0.19148936170212771,0.7936507936507936,0.627906976744186,0.5443037974683543,love sleeping like dead without commitment,"['love', 'sleeping', 'like', 'dead', 'without', 'commitment']"
"If we're not meant to have midnight snacks, why is there a light in the fridge? 🌜🍕",0.6363636363636362,0.46808510638297873,0.7142857142857143,0.7209302325581395,0.5063291139240506,meant midnight snacks light fridge,"['meant', 'midnight', 'snack', 'light', 'fridge']"
I'm not sure if I have free time or if I'm just forgetting everything I have to do. 🤔🕰️,0.5454545454545454,0.5744680851063829,0.6666666666666666,0.6511627906976744,0.6962025316455696,im sure free time im forgetting everything,"['sure', 'free', 'time', 'forgetting', 'everything']"
Whoever said nothing is impossible obviously never tried slamming a revolving door. 🚪🙅‍♂️,0.6818181818181817,0.29787234042553196,0.8253968253968254,0.39534883720930236,0.7088607594936709,whoever said nothing impossible obviously never tried slamming revolving door,"['whoever', 'said', 'nothing', 'impossible', 'obviously', 'never', 'tried', 'slamming', 'revolving', 'door']"
"If you're happier than me, it's probably because you're thinking about dogs right now. 🐶😊",0.6136363636363635,0.5957446808510638,0.7777777777777777,0.34883720930232565,0.6455696202531644,youre happier probably youre thinking dogs right,"['happier', 'probably', 'thinking', 'dog', 'right']"
"I never knew how strong I was until I had to forgive someone who wasn't sorry, and accept an apology I never received. 💪🤐",0.5681818181818181,0.4255319148936171,0.7301587301587301,0.744186046511628,0.5316455696202531,never knew strong forgive someone wasnt sorry accept apology never received,"['never', 'knew', 'strong', 'forgive', 'someone', 'sorry', 'accept', 'apology', 'never', 'received']"
I'm not great at the advice. Can I interest you in a sarcastic comment? 🙃💬,0.7272727272727273,0.2553191489361702,0.8412698412698412,0.5581395348837209,0.5822784810126581,im great advice interest sarcastic comment,"['great', 'advice', 'interest', 'sarcastic', 'comment']"
"Some people are like clouds. When they disappear, it's a brighter day. ☁️🌞",0.6363636363636362,0.3829787234042553,0.8571428571428572,0.4651162790697675,0.620253164556962,people like clouds disappear brighter day,"['people', 'like', 'cloud', 'disappear', 'brighter', 'day']"
"Got called 'pretty' today! Well, actually the full statement was 'You're pretty annoying.' but I only focus on positive things. 😊🎉",0.5909090909090908,0.5106382978723405,0.746031746031746,0.5348837209302325,0.721518987341772,got called pretty today well actually full statement youre pretty annoying focus positive things,"['got', 'called', 'today', 'well', 'actually', 'full', 'statement', 'pretty', 'annoying', 'focus', 'positive', 'thing']"
"I've got 99 problems, and 86 of them are completely made up scenarios in my head that I'm stressing about for absolutely no logical reason. 🤯🔢",0.6136363636363635,0.44680851063829785,0.7619047619047619,0.37209302325581395,0.7088607594936709,ive got 99 problems 86 completely made scenarios head im stressing absolutely logical reason,"['got', 'problem', 'completely', 'made', 'scenario', 'head', 'stressing', 'absolutely', 'logical', 'reason']"
"Sometimes I wonder how you put up with me. Then I remember, oh I put up with you. So we're even. 😅🤝",0.75,0.21276595744680848,0.8095238095238094,0.5116279069767442,0.5949367088607593,sometimes wonder put remember oh put even,"['sometimes', 'wonder', 'put', 'remember', 'oh', 'put', 'even']"
I'm not really a control freak. But can I show you the right way to do that? 😇👌,0.5454545454545454,0.5531914893617021,0.7777777777777777,0.4418604651162791,0.6835443037974682,im really control freak show right way,"['really', 'control', 'freak', 'show', 'right', 'way']"
"Sure, I do marathons. On Netflix. 🏃‍♂️📺",0.6818181818181817,0.2765957446808511,0.8412698412698412,0.6976744186046512,0.5316455696202531,sure marathons netflix,"['sure', 'marathon', 'netflix']"
"I'm not sure what's tighter, our jeans or our company budget. 👖💰",0.6363636363636362,0.4255319148936171,0.6984126984126984,0.6046511627906977,0.6962025316455696,im sure whats tighter jeans company budget,"['sure', 'tighter', 'jean', 'company', 'budget']"
Let's have a moment of silence for all those who are stuck in traffic on their way to the gym to ride stationary bicycles. 🚗🚲,0.5681818181818181,0.5957446808510638,0.7142857142857143,0.4883720930232559,0.721518987341772,lets moment silence stuck traffic way gym ride stationary bicycles,"['let', 'moment', 'silence', 'stuck', 'traffic', 'way', 'gym', 'ride', 'stationary', 'bicycle']"
"Don't grow up, it's a trap. 🧒🕳️",0.6590909090909092,0.2553191489361702,0.746031746031746,0.7674418604651163,0.5063291139240506,dont grow trap,"['grow', 'trap']"
Common sense is like deodorant. The people who need it most never use it. 🤦‍♂️💡,0.75,0.36170212765957444,0.7936507936507936,0.39534883720930236,0.6708860759493669,common sense like deodorant people need never use,"['common', 'sense', 'like', 'deodorant', 'people', 'need', 'never', 'use']"
Why do they call it a drive-through if you have to stop? 🚗🍔,0.5909090909090908,0.4893617021276596,0.6825396825396824,0.744186046511628,0.5569620253164556,call drivethrough stop,"['call', 'stop']"
"Adulthood is like looking both ways before you cross the street and then getting hit by an airplane. 🚶‍
I found this blog post to be quite insightful.""",0.6590909090909092,0.5957446808510638,0.7619047619047619,0.6976744186046512,0.5189873417721518,adulthood like looking ways cross street getting hit airplane found blog post quite insightful,"['adulthood', 'like', 'looking', 'way', 'cross', 'street', 'getting', 'hit', 'airplane', 'found', 'blog', 'post', 'quite', 'insightful']"
The information provided here is very helpful.,0.5681818181818181,0.7021276595744681,0.6666666666666666,0.7674418604651163,0.5443037974683543,information provided helpful,"['information', 'provided', 'helpful']"
I love how this article explains complex concepts.,0.7272727272727273,0.5319148936170214,0.746031746031746,0.6744186046511628,0.48101265822784806,love article explains complex concepts,"['love', 'article', 'explains', 'complex', 'concept']"
This blog post resonated with me on a personal level.,0.6136363636363635,0.6382978723404256,0.7777777777777777,0.744186046511628,0.5063291139240506,blog post resonated personal level,"['blog', 'post', 'resonated', 'personal', 'level']"
The author did a great job explaining the topic.,0.6818181818181817,0.6595744680851063,0.7301587301587301,0.627906976744186,0.5316455696202531,author great job explaining topic,"['author', 'great', 'job', 'explaining', 'topic']"
I appreciate the effort put into this article.,0.5227272727272727,0.7446808510638299,0.6507936507936507,0.7209302325581395,0.5696202531645569,appreciate effort put article,"['appreciate', 'effort', 'put', 'article']"
Such a well-written and informative post!,0.7045454545454546,0.5531914893617021,0.7777777777777777,0.6976744186046512,0.49367088607594933,wellwritten informative post,"['informative', 'post']"
I'm amazed by the depth of research in this article.,0.6363636363636362,0.6170212765957447,0.7142857142857143,0.7674418604651163,0.5189873417721518,im amazed depth research article,"['amazed', 'depth', 'research', 'article']"
This blog post deserves a lot of recognition.,0.75,0.5106382978723405,0.7936507936507936,0.6511627906976744,0.4683544303797468,blog post deserves lot recognition,"['blog', 'post', 'deserves', 'lot', 'recognition']"
I couldn't agree more with the points made here.,0.6590909090909092,0.7234042553191489,0.746031746031746,0.744186046511628,0.49367088607594933,couldnt agree points made,"['could', 'agree', 'point', 'made']"
This article is a must-read for everyone.,0.7272727272727273,0.6808510638297872,0.8095238095238094,0.6511627906976744,0.48101265822784806,article mustread everyone,"['article', 'everyone']"
I'm impressed by the author's knowledge on this topic.,0.6818181818181817,0.6382978723404256,0.7619047619047619,0.7209302325581395,0.5443037974683543,im impressed authors knowledge topic,"['impressed', 'author', 'knowledge', 'topic']"
I wish I had read this sooner. Very insightful!,0.6363636363636362,0.7446808510638299,0.7301587301587301,0.7906976744186047,0.5569620253164556,wish read sooner insightful,"['wish', 'read', 'sooner', 'insightful']"
Thank you for sharing such valuable information.,0.5454545454545454,0.7872340425531916,0.6666666666666666,0.7674418604651163,0.5822784810126581,thank sharing valuable information,"['thank', 'sharing', 'valuable', 'information']"
This blog post has given me a new perspective.,0.6136363636363635,0.6170212765957447,0.7619047619047619,0.744186046511628,0.5316455696202531,blog post given new perspective,"['blog', 'post', 'given', 'new', 'perspective']"
I've learned a lot from reading this article.,0.7045454545454546,0.6595744680851063,0.8095238095238094,0.6744186046511628,0.5063291139240506,ive learned lot reading article,"['learned', 'lot', 'reading', 'article']"
The author's expertise on this subject is evident.,0.75,0.5744680851063829,0.746031746031746,0.6976744186046512,0.4683544303797468,authors expertise subject evident,"['author', 'expertise', 'subject', 'evident']"
I'm grateful for the insights provided in this post.,0.6590909090909092,0.7021276595744681,0.7777777777777777,0.7209302325581395,0.5189873417721518,im grateful insights provided post,"['grateful', 'insight', 'provided', 'post']"
Kudos to the author for a well-researched article.,0.7272727272727273,0.6382978723404256,0.7936507936507936,0.744186046511628,0.48101265822784806,kudos author wellresearched article,"['kudos', 'author', 'article']"
This blog post is a valuable resource for me.,0.6363636363636362,0.7659574468085106,0.7142857142857143,0.7906976744186047,0.5696202531645569,blog post valuable resource,"['blog', 'post', 'valuable', 'resource']"
The author's passion for the topic shines through.,0.6818181818181817,0.6170212765957447,0.7777777777777777,0.7674418604651163,0.5443037974683543,authors passion topic shines,"['author', 'passion', 'topic', 'shine']"
I appreciate the practical advice in this article.,0.5909090909090908,0.7446808510638299,0.6825396825396824,0.6976744186046512,0.5569620253164556,appreciate practical advice article,"['appreciate', 'practical', 'advice', 'article']"
This post has inspired me to take action.,0.6136363636363635,0.7234042553191489,0.7619047619047619,0.7674418604651163,0.5316455696202531,post inspired take action,"['post', 'inspired', 'take', 'action']"
Reading this blog post was time well spent.,0.7045454545454546,0.6808510638297872,0.8253968253968254,0.627906976744186,0.49367088607594933,reading blog post time well spent,"['reading', 'blog', 'post', 'time', 'well', 'spent']"
The insights shared here are eye-opening.,0.6590909090909092,0.7872340425531916,0.746031746031746,0.7209302325581395,0.5063291139240506,insights shared eyeopening,"['insight', 'shared']"
I feel more informed after reading this article.,0.75,0.5957446808510638,0.7936507936507936,0.744186046511628,0.4683544303797468,feel informed reading article,"['feel', 'informed', 'reading', 'article']"
An excellent piece that deserves recognition.,0.7272727272727273,0.6170212765957447,0.8095238095238094,0.6976744186046512,0.48101265822784806,excellent piece deserves recognition,"['excellent', 'piece', 'deserves', 'recognition']"
I'm impressed by the author's research and analysis.,0.6818181818181817,0.6808510638297872,0.7619047619047619,0.7209302325581395,0.5316455696202531,im impressed authors research analysis,"['impressed', 'author', 'research', 'analysis']"
This blog post is a valuable addition to my knowledge.,0.6363636363636362,0.7659574468085106,0.7301587301587301,0.744186046511628,0.5569620253164556,blog post valuable addition knowledge,"['blog', 'post', 'valuable', 'addition', 'knowledge']"
Thank you for sharing such valuable insights.,0.6136363636363635,0.7446808510638299,0.746031746031746,0.7674418604651163,0.5822784810126581,thank sharing valuable insights,"['thank', 'sharing', 'valuable', 'insight']"
I couldn't agree more with the author's perspective.,0.6590909090909092,0.7872340425531916,0.7619047619047619,0.744186046511628,0.49367088607594933,couldnt agree authors perspective,"['could', 'agree', 'author', 'perspective']"
This article has provided me with valuable information.,0.7272727272727273,0.7021276595744681,0.8253968253968254,0.7674418604651163,0.5189873417721518,article provided valuable information,"['article', 'provided', 'valuable', 'information']"
The author's expertise shines through in this post.,0.75,0.6595744680851063,0.8095238095238094,0.6976744186046512,0.5063291139240506,authors expertise shines post,"['author', 'expertise', 'shine', 'post']"
I appreciate the depth of research in this article.,0.7045454545454546,0.7234042553191489,0.7777777777777777,0.744186046511628,0.5443037974683543,appreciate depth research article,"['appreciate', 'depth', 'research', 'article']"
This blog post is a goldmine of information.,0.6818181818181817,0.6382978723404256,0.7936507936507936,0.7209302325581395,0.5696202531645569,blog post goldmine information,"['blog', 'post', 'goldmine', 'information']"
I'm grateful for the insights shared in this article.,0.6363636363636362,0.7446808510638299,0.7619047619047619,0.7906976744186047,0.5949367088607593,im grateful insights shared article,"['grateful', 'insight', 'shared', 'article']"
An excellent article that deserves recognition.,0.6136363636363635,0.7659574468085106,0.746031746031746,0.744186046511628,0.5569620253164556,excellent article deserves recognition,"['excellent', 'article', 'deserves', 'recognition']"
The author's passion for the topic is evident.,0.6590909090909092,0.7234042553191489,0.7777777777777777,0.7674418604651163,0.5822784810126581,authors passion topic evident,"['author', 'passion', 'topic', 'evident']"
I feel more informed after reading this post.,0.7272727272727273,0.6808510638297872,0.8253968253968254,0.6976744186046512,0.5316455696202531,feel informed reading post,"['feel', 'informed', 'reading', 'post']"
This blog post is a valuable resource for me.,0.7045454545454546,0.7021276595744681,0.8095238095238094,0.7209302325581395,0.5316455696202531,blog post valuable resource,"['blog', 'post', 'valuable', 'resource']"
I appreciate the practical advice in this article.,0.6818181818181817,0.7446808510638299,0.7619047619047619,0.7674418604651163,0.5189873417721518,appreciate practical advice article,"['appreciate', 'practical', 'advice', 'article']"
This post has inspired me to take action.,0.6363636363636362,0.7659574468085106,0.7301587301587301,0.744186046511628,0.5443037974683543,post inspired take action,"['post', 'inspired', 'take', 'action']"
Reading this article was time well spent.,0.6136363636363635,0.7234042553191489,0.7619047619047619,0.7674418604651163,0.5569620253164556,reading article time well spent,"['reading', 'article', 'time', 'well', 'spent']"
The insights shared here are truly eye-opening.,0.6590909090909092,0.7872340425531916,0.746031746031746,0.744186046511628,0.49367088607594933,insights shared truly eyeopening,"['insight', 'shared', 'truly']"
I feel more informed after reading this blog post.,0.75,0.6170212765957447,0.7936507936507936,0.7209302325581395,0.4683544303797468,feel informed reading blog post,"['feel', 'informed', 'reading', 'blog', 'post']"
An excellent piece that deserves recognition.,0.7272727272727273,0.6382978723404256,0.8095238095238094,0.6976744186046512,0.48101265822784806,excellent piece deserves recognition,"['excellent', 'piece', 'deserves', 'recognition']"
I'm impressed by the author's research and analysis.,0.6818181818181817,0.7021276595744681,0.7777777777777777,0.7209302325581395,0.5696202531645569,im impressed authors research analysis,"['impressed', 'author', 'research', 'analysis']"
This blog post is a valuable addition to my knowledge.,0.6363636363636362,0.7446808510638299,0.7619047619047619,0.7906976744186047,0.5949367088607593,blog post valuable addition knowledge,"['blog', 'post', 'valuable', 'addition', 'knowledge']"
Thank you for sharing such valuable insights.,0.6136363636363635,0.7659574468085106,0.746031746031746,0.7674418604651163,0.5822784810126581,thank sharing valuable insights,"['thank', 'sharing', 'valuable', 'insight']"
I couldn't agree more with the author's perspective.,0.6590909090909092,0.7872340425531916,0.7619047619047619,0.744186046511628,0.49367088607594933,couldnt agree authors perspective,"['could', 'agree', 'author', 'perspective']"
This article has provided me with valuable information.,0.7272727272727273,0.7021276595744681,0.8253968253968254,0.7674418604651163,0.5189873417721518,article provided valuable information,"['article', 'provided', 'valuable', 'information']"
The author's expertise shines through in this post.,0.75,0.6595744680851063,0.8095238095238094,0.6976744186046512,0.5063291139240506,authors expertise shines post,"['author', 'expertise', 'shine', 'post']"
I appreciate the depth of research in this article.,0.7045454545454546,0.7234042553191489,0.7777777777777777,0.744186046511628,0.5443037974683543,appreciate depth research article,"['appreciate', 'depth', 'research', 'article']"
This blog post is a goldmine of information.,0.6818181818181817,0.6382978723404256,0.7936507936507936,0.7209302325581395,0.5696202531645569,blog post goldmine information,"['blog', 'post', 'goldmine', 'information']"
I'm grateful for the insights shared in this article.,0.6363636363636362,0.7446808510638299,0.7619047619047619,0.7906976744186047,0.5949367088607593,im grateful insights shared article,"['grateful', 'insight', 'shared', 'article']"
